{
    "task_id": "TASK-0001",
    "polaris_version": "0.1.1",
    "workflow_version": "0.1.1",
    "current_revision": 1,
    "status": "CLOSED",
    "rigor": "R0",
    "sequence": 10,
    "blocked_from": null,
    "blocker": null,
    "artifacts": {
        "plan": {
            "path": "PLAN.md",
            "sha256": "269fa3d57150e5b5dd07804363a6c063df5f4fdb3cadd1681d29e86ba564f96f"
        },
        "working_set": {
            "path": "WORKING_SET.md",
            "sha256": "3f3a7e2b61bd88c2418b9d15c4c441fd8616d32dbbfa71582a91ff14278f4d73"
        },
        "implementation": {
            "path": "implementations/r001/attempt-001.json",
            "sha256": "cb01ae474d8975b470186aab27c2daf6a9bffe34ea56993443abe431ca5c7453"
        },
        "knowledge_delta": {
            "path": "knowledge/r001/knowledge-delta-001.json",
            "sha256": "145e731a54253a9cae086756c947659f0e861ccdea3b7e6fb00f23894e0bbf47"
        },
        "review_handoff": {
            "path": "reviews/r001/handoff-001.json",
            "sha256": "56cfeb732c89db47d82ac0a324b3cb7b3f07554f6109864ed0846115d8c4ba90"
        },
        "review": {
            "path": "reviews/r001/review-001.json",
            "sha256": "2917a82ff4e40180d0f6870552180c9e54b18c4d6d93dcec4757ca1674344d45"
        },
        "validation": {
            "path": "validations/r001/validation-001.json",
            "sha256": "a9a2fcff0f0f92aa9bf4a0c325fdf5d4498285918b0936c3b37495d681f1fec0"
        },
        "result": {
            "path": "results/r001/result-001.json",
            "sha256": "315d70ede6270660981ddfc90aab0ba9c272ac52c390ed5881d1a9ecb50e4879"
        }
    },
    "subject": {
        "base_commit": "3c86b5335d531b662e127bb5da6d8b442bf75af0",
        "head_commit": "7e10dae772c07c03c29ea122d4e80a1e18d31262",
        "diff_hash": "f8da6ed86a18043f59f80383eefe6a376b14103658d1f1afa1e0aa4e8b52237a"
    }
}
